{
  "domain": "property-project-funds",
  "version": 2,
  "sample_id": "sample-020",
  "description": "虚构样例：项目公司独立账、主办银行监管、施工节点拨付、预售/现房销售与风险接管的关联数据，不含真实个人信息或账号。",

  "regimes": [
    {
      "id": "REG-2020",
      "name": "预售资金监管基线规则",
      "effective_from": "2020-01-01",
      "rules": {
        "presale_receipts_into_escrow": true,
        "disbursement_requires_verified_node": true,
        "related_party_freeze_review": false,
        "existing_sale_requires_completion_filing": false
      }
    },
    {
      "id": "REG-2024",
      "name": "强化预售监管与现房销售规则",
      "effective_from": "2024-01-01",
      "rules": {
        "presale_receipts_into_escrow": true,
        "disbursement_requires_verified_node": true,
        "related_party_freeze_review": true,
        "hq_transfer_freeze_review": true,
        "off_account_repayment_freeze_review": true,
        "existing_sale_requires_completion_filing": true,
        "existing_sale_requires_visible_listing": true
      }
    }
  ],
  "policy_changes": [
    {
      "id": "PC-2024",
      "new_regime_id": "REG-2024",
      "changed_at": "2024-01-01",
      "retroactive": false,
      "note": "制度变化只约束变化后签署的合同与发生的拨付；已签署预售合同继续按签署时规则执行，不追溯改写旧合同。"
    }
  ],

  "actors": [
    {"id": "ORG-HC", "kind": "authority", "name": "滨江区住房和城乡建设局（监管部门）"},
    {"id": "BANK-001", "kind": "bank", "name": "江州银行滨江支行（主办银行）"},
    {"id": "SUP-001", "kind": "supervisor", "name": "江州工程监理有限公司"},
    {"id": "SPV-001", "kind": "project_company", "name": "滨江安居置业有限公司（项目公司）", "parent_id": "HQ-001", "independent_ledger_id": "LED-PRJ-001"},
    {"id": "HQ-001", "kind": "group_hq", "name": "云澜控股集团股份有限公司（开发企业总部）"},
    {"id": "RP-001", "kind": "contractor_related", "name": "云澜建设集团有限公司（总部关联总包）", "related_to": "HQ-001"},
    {"id": "GC-001", "kind": "contractor", "name": "江州建工集团有限公司（非关联总包）"},
    {"id": "TO-001", "kind": "takeover_entity", "name": "江州城市建设投资集团有限公司（风险接管主体）"},
    {"id": "STATE", "kind": "treasury", "name": "国库（税费收缴）"},
    {"id": "BY-101", "kind": "buyer", "name": "购房人 BY-101"},
    {"id": "BY-102", "kind": "buyer", "name": "购房人 BY-102"},
    {"id": "BY-201", "kind": "buyer", "name": "购房人 BY-201"},
    {"id": "BY-301", "kind": "buyer", "name": "购房人 BY-301"},
    {"id": "BY-401", "kind": "buyer", "name": "购房人 BY-401"}
  ],

  "projects": [
    {
      "id": "PRJ-001",
      "name": "云澜·江湾府",
      "company_id": "SPV-001",
      "lead_bank_id": "BANK-001",
      "ledger_id": "LED-PRJ-001",
      "parcels": [
        {"id": "P-01", "name": "地块一", "land_use_cert": "DOC-LAND-P01"},
        {"id": "P-02", "name": "地块二", "land_use_cert": "DOC-LAND-P02"}
      ],
      "buildings": [
        {
          "id": "B-1", "parcel_id": "P-01", "name": "1号楼", "presale_permit_id": "PS-2022-011",
          "sale_mode": "presale", "supervised_quota_cny": 9000000,
          "completion_filing_id": null, "planned_delivery": "2025-12-31"
        },
        {
          "id": "B-2", "parcel_id": "P-01", "name": "2号楼", "presale_permit_id": "PS-2022-012",
          "sale_mode": "presale", "supervised_quota_cny": 12000000,
          "completion_filing_id": null, "planned_delivery": "2026-03-31"
        },
        {
          "id": "B-3", "parcel_id": "P-02", "name": "3号楼", "presale_permit_id": null,
          "sale_mode": "existing", "supervised_quota_cny": 0,
          "completion_filing_id": "DOC-FIL-B3", "completion_filing_at": "2024-09-02"
        },
        {
          "id": "B-4", "parcel_id": "P-02", "name": "4号楼", "presale_permit_id": null,
          "sale_mode": "existing", "supervised_quota_cny": 0,
          "completion_filing_id": "DOC-FIL-B4", "completion_filing_at": "2024-10-18"
        },
        {
          "id": "B-5", "parcel_id": "P-02", "name": "5号楼", "presale_permit_id": null,
          "sale_mode": "construction_only", "supervised_quota_cny": 7000000,
          "completion_filing_id": null, "planned_delivery": "2026-12-31"
        }
      ]
    }
  ],

  "units": [
    {"id": "U-101", "building_id": "B-1", "room": "1-101"},
    {"id": "U-102", "building_id": "B-1", "room": "1-102"},
    {"id": "U-201", "building_id": "B-2", "room": "2-201"},
    {"id": "U-301", "building_id": "B-3", "room": "3-301"},
    {"id": "U-401", "building_id": "B-4", "room": "4-401"},
    {"id": "U-501", "building_id": "B-5", "room": "5-501"}
  ],

  "accounts": [
    {"id": "ACC-ESC-01", "bank_id": "BANK-001", "holder_id": "SPV-001", "type": "presale_escrow", "name": "预售资金监管归集户", "project_id": "PRJ-001"},
    {"id": "ACC-NEW-01", "bank_id": "BANK-001", "holder_id": "SPV-001", "type": "existing_sale_settlement", "name": "现房销售结算户", "project_id": "PRJ-001"},
    {"id": "ACC-SET-02", "bank_id": "BANK-001", "holder_id": "SPV-001", "type": "general_settlement", "name": "项目公司一般结算户", "project_id": "PRJ-001"},
    {"id": "ACC-HQ-01", "bank_id": "BANK-OTHER", "holder_id": "HQ-001", "type": "external_hq", "name": "总部账户"},
    {"id": "ACC-RP-01", "bank_id": "BANK-OTHER", "holder_id": "RP-001", "type": "external_contractor", "name": "关联总包收款户"},
    {"id": "ACC-GC-01", "bank_id": "BANK-001", "holder_id": "GC-001", "type": "external_contractor", "name": "非关联总包收款户"},
    {"id": "ACC-TAX-01", "bank_id": "TREASURY", "holder_id": "STATE", "type": "treasury", "name": "国库税费户"},
    {"id": "ACC-MCH-HQ", "bank_id": "BANK-OTHER", "holder_id": "HQ-001", "type": "external_merchant", "name": "总部关联POS商户（账户外回款通道）"},
    {"id": "ACC-BY-102", "bank_id": "BANK-CARD", "holder_id": "BY-102", "type": "buyer_card", "name": "购房人 BY-102 原付款卡"}
  ],

  "construction_nodes": [
    {"id": "N-B1-01", "building_id": "B-1", "name": "基础与地下结构完成", "weight": 0.20},
    {"id": "N-B1-02", "building_id": "B-1", "name": "主体结构封顶", "weight": 0.35},
    {"id": "N-B1-03", "building_id": "B-1", "name": "安装与装饰完成", "weight": 0.20},
    {"id": "N-B1-04", "building_id": "B-1", "name": "竣工验收备案", "weight": 0.25},
    {"id": "N-B2-01", "building_id": "B-2", "name": "基础与地下结构完成", "weight": 0.25},
    {"id": "N-B2-02", "building_id": "B-2", "name": "主体结构封顶", "weight": 0.35},
    {"id": "N-B2-03", "building_id": "B-2", "name": "安装与装饰完成", "weight": 0.15},
    {"id": "N-B2-04", "building_id": "B-2", "name": "竣工验收备案", "weight": 0.25},
    {"id": "N-B3-01", "building_id": "B-3", "name": "基础与地下结构完成", "weight": 0.20},
    {"id": "N-B3-02", "building_id": "B-3", "name": "主体结构封顶", "weight": 0.35},
    {"id": "N-B3-03", "building_id": "B-3", "name": "安装与装饰完成", "weight": 0.20},
    {"id": "N-B3-04", "building_id": "B-3", "name": "竣工验收备案", "weight": 0.25},
    {"id": "N-B4-01", "building_id": "B-4", "name": "基础与地下结构完成", "weight": 0.20},
    {"id": "N-B4-02", "building_id": "B-4", "name": "主体结构封顶", "weight": 0.35},
    {"id": "N-B4-03", "building_id": "B-4", "name": "安装与装饰完成", "weight": 0.20},
    {"id": "N-B4-04", "building_id": "B-4", "name": "竣工验收备案", "weight": 0.25},
    {"id": "N-B5-01", "building_id": "B-5", "name": "基础与地下结构完成", "weight": 0.25},
    {"id": "N-B5-02", "building_id": "B-5", "name": "主体结构封顶", "weight": 0.35},
    {"id": "N-B5-03", "building_id": "B-5", "name": "安装与装饰完成", "weight": 0.15},
    {"id": "N-B5-04", "building_id": "B-5", "name": "竣工验收备案", "weight": 0.25}
  ],
  "node_verifications": [
    {"id": "V-B1-01", "node_id": "N-B1-01", "verified_at": "2023-02-18", "verifiers": ["SUP-001", "SPV-001"], "report_doc": "DOC-R-VB101"},
    {"id": "V-B1-02", "node_id": "N-B1-02", "verified_at": "2023-09-08", "verifiers": ["SUP-001", "SPV-001", "ORG-HC"], "report_doc": "DOC-R-VB102"},
    {"id": "V-B1-03", "node_id": "N-B1-03", "verified_at": "2025-07-28", "verifiers": ["SUP-001", "SPV-001", "ORG-HC", "TO-001"], "report_doc": "DOC-R-VB103"},
    {"id": "V-B2-01", "node_id": "N-B2-01", "verified_at": "2024-05-15", "verifiers": ["SUP-001", "SPV-001", "ORG-HC"], "report_doc": "DOC-R-VB201"},
    {"id": "V-B3-01", "node_id": "N-B3-01", "verified_at": "2023-10-10", "verifiers": ["SUP-001", "SPV-001"], "report_doc": "DOC-R-VB301"},
    {"id": "V-B3-02", "node_id": "N-B3-02", "verified_at": "2024-01-12", "verifiers": ["SUP-001", "SPV-001"], "report_doc": "DOC-R-VB302"},
    {"id": "V-B3-03", "node_id": "N-B3-03", "verified_at": "2024-06-20", "verifiers": ["SUP-001", "SPV-001"], "report_doc": "DOC-R-VB303"},
    {"id": "V-B3-04", "node_id": "N-B3-04", "verified_at": "2024-08-18", "verifiers": ["SUP-001", "SPV-001", "ORG-HC"], "report_doc": "DOC-R-VB304"},
    {"id": "V-B4-01", "node_id": "N-B4-01", "verified_at": "2023-12-05", "verifiers": ["SUP-001", "SPV-001"], "report_doc": "DOC-R-VB401"},
    {"id": "V-B4-02", "node_id": "N-B4-02", "verified_at": "2024-03-22", "verifiers": ["SUP-001", "SPV-001"], "report_doc": "DOC-R-VB402"},
    {"id": "V-B4-03", "node_id": "N-B4-03", "verified_at": "2024-08-02", "verifiers": ["SUP-001", "SPV-001"], "report_doc": "DOC-R-VB403"},
    {"id": "V-B4-04", "node_id": "N-B4-04", "verified_at": "2024-10-08", "verifiers": ["SUP-001", "SPV-001", "ORG-HC"], "report_doc": "DOC-R-VB404"},
    {"id": "V-B5-01", "node_id": "N-B5-01", "verified_at": "2025-05-16", "verifiers": ["SUP-001", "SPV-001"], "report_doc": "DOC-R-VB501"}
  ],

  "statutory_obligations": [
    {"id": "SO-001", "kind": "tax", "name": "增值税及附加", "amount_due_cny": 1200000, "due_at": "2025-04-15", "payee_account_id": "ACC-TAX-01"}
  ],

  "listings": [
    {"id": "LS-B1", "building_id": "B-1", "status": "presale_permitted", "status_name": "期房在售", "published_by": "ORG-HC", "published_at": "2022-11-01", "evidence_doc": "DOC-LS-B1"},
    {"id": "LS-B2", "building_id": "B-2", "status": "presale_permitted", "status_name": "期房在售", "published_by": "ORG-HC", "published_at": "2022-11-01", "evidence_doc": "DOC-LS-B2"},
    {"id": "LS-B3", "building_id": "B-3", "status": "existing_visible", "status_name": "现房可售（已竣工验收备案）", "published_by": "ORG-HC", "published_at": "2024-09-10", "evidence_doc": "DOC-LS-B3"},
    {"id": "LS-B4", "building_id": "B-4", "status": "existing_visible", "status_name": "现房可售（已竣工验收备案）", "published_by": "ORG-HC", "published_at": "2024-10-25", "evidence_doc": "DOC-LS-B4"},